<?xml version="1.0" encoding="UTF-8"?>
<Symbols xmlns:xsi="http://www.w3.org/2001/XMLSchema-instance" xsi:noNamespaceSchemaLocation="symbolSchema.xsd">
	
	<Default>
		<Size width="160" height="27"/>
		<SymbolElement type="image">
            <Parameter key="resource" value="emptyPO"/>
		</SymbolElement>
		<SymbolElement type="text">
			<Parameter key="r" value="255"/>
			<Parameter key="g" value="255"/>
			<Parameter key="b" value="255"/>
		</SymbolElement>
	</Default>
	
			
</Symbols>
